category,subcategory,title,description,filterTag,dashboardURL,requestAccessURL,contactEmail,lastUpdated,ownerTeam,status
Product Solutions,Receivables,Receivables SLA Compliance,"Credit turnaround times, same-day vs next-day credits, and SLA breach analysis.",Specialized and Other,#,recv-access@company.com,receivables-analytics@company.com,Jun 2026,Receivables Analytics,Live
Product Solutions,Payables,Payables Volume & Value,"Total payment instructions processed by payment type, currency, and client with trend analysis.",Business Performance,#,pay-access@company.com,payables-analytics@company.com,Jun 2026,Payables Analytics,Live
Product Solutions,Payables,Payment Success Rates,"Transaction success, failure, and return rates by payment rail, bank, and reason code.",Specialized and Other,#,pay-access@company.com,payables-analytics@company.com,Jun 2026,Payables Analytics,Live
Product Solutions,Payables,Payables Revenue Dashboard,"Fee income from payment services, bulk disbursements, and value-added payables solutions.",Business Performance,#,pay-access@company.com,payables-analytics@company.com,May 2026,Payables Analytics,Live
Product Solutions,Payables,Bulk Disbursement Tracker,"Salary, vendor, and dividend disbursement volumes, processing times, and SLA adherence.",Business Performance,#,pay-access@company.com,payables-analytics@company.com,Jun 2026,Payables Analytics,Live
Product Solutions,Payables,RTGS & NEFT Analytics,"RTGS and NEFT transaction volumes, value bands, and processing windows by client segment.",Specialized and Other,#,pay-access@company.com,payables-analytics@company.com,Jun 2026,Payables Analytics,Live
Product Solutions,Payables,Payables RM Performance,"RM client meetings, mandates won, and payables revenue per relationship manager.",Employee Performance,#,pay-access@company.com,payables-analytics@company.com,Apr 2026,Payables Analytics,Live
Product Solutions,Payables,Supplier Finance Dashboard,"Supplier onboarding, early payment utilisation, and programme yield for payables finance programmes.",Specialized and Other,#,pay-access@company.com,payables-analytics@company.com,Jun 2026,Payables Analytics,Live
Product Solutions,Payables,Payables Client Wallet,Share of client payables wallet by payment type with opportunity sizing for uncaptured flows.,Relationship Intelligence,#,pay-access@company.com,payables-analytics@company.com,May 2026,Payables Analytics,Live
Product Solutions,Payables,Vendor Payment Analytics,"Vendor payment frequency, average payment days, and discount capture rates for client portfolios.",Relationship Intelligence,#,pay-access@company.com,payables-analytics@company.com,Jun 2026,Payables Analytics,Live
Product Solutions,Payables,Payables Fraud Monitor,"Suspicious payment alerts, mule account flags, and fraud prevention outcomes by channel.",Specialized and Other,#,pay-access@company.com,payables-analytics@company.com,Jun 2026,Payables Analytics,Live
Product Solutions,Trade & Working Capital,Working Capital Overview,"Holistic client working capital health — receivables, payables, and inventory cycle metrics.",Business Performance,#,twc-access@company.com,twc-analytics@company.com,Jun 2026,TWC Analytics,Live
Product Solutions,Trade & Working Capital,Invoice Financing Dashboard,"Invoice discounting volumes, approval rates, advance amounts, and fee income by client.",Business Performance,#,twc-access@company.com,twc-analytics@company.com,Jun 2026,TWC Analytics,Live
Product Solutions,Trade & Working Capital,Supply Chain Finance Performance,"SCF programme onboarding, utilisation rates, yield, and supplier adoption by buyer programme.",Business Performance,#,twc-access@company.com,twc-analytics@company.com,May 2026,TWC Analytics,Live
Product Solutions,Trade & Working Capital,Channel Finance Analytics,"Dealer and distributor finance programme utilisation, outstanding amounts, and overdue tracking.",Specialized and Other,#,twc-access@company.com,twc-analytics@company.com,Jun 2026,TWC Analytics,Live
Product Solutions,Trade & Working Capital,Working Capital RM Activity,"RM call activity on working capital solutions, proposals in pipeline, and mandate conversion.",Employee Performance,#,twc-access@company.com,twc-analytics@company.com,Jun 2026,TWC Analytics,Live
Product Solutions,Trade & Working Capital,Factoring & Forfaiting Monitor,"Factoring portfolio size, advance rates, credit insurance coverage, and collection performance.",Specialized and Other,#,twc-access@company.com,twc-analytics@company.com,Apr 2026,TWC Analytics,Live
Product Solutions,Trade & Working Capital,Client WC Wallet Share,Bank share of client working capital financing with competitive landscape and gap analysis.,Relationship Intelligence,#,twc-access@company.com,twc-analytics@company.com,Jun 2026,TWC Analytics,Live
Product Solutions,Trade & Working Capital,Inventory Finance Dashboard,"Warehouse receipt finance and inventory pledging volumes, valuation, and risk metrics.",Specialized and Other,#,twc-access@company.com,twc-analytics@company.com,May 2026,TWC Analytics,Live
Product Solutions,Trade & Working Capital,WC Revenue Breakdown,"Revenue from working capital products — fees, spreads, and processing income by product line.",Business Performance,#,twc-access@company.com,twc-analytics@company.com,Jun 2026,TWC Analytics,Live
Product Solutions,Trade & Working Capital,Overdue & NPA Tracker,"Overdue amounts, ageing profile, and NPA migration for the working capital portfolio.",Specialized and Other,#,twc-access@company.com,twc-analytics@company.com,Jun 2026,TWC Analytics,Live
